[
    {
        "package_version": "1.0",
        "generated_by": "Phase3.8 AegisAI Package Builder",
        "incident": {
            "id": "INC-001",
            "type": "runtime_compromise",
            "severity": "CRITICAL",
            "detected_at": "21:05:18.611052300"
        },
        "root_cause": {
            "id": "runtime_compromise",
            "name": "Runtime Compromise",
            "hint": "Likely runtime compromise caused by interactive shell activity and sensitive file access.",
            "confidence": 0.95
        },
        "signals": [
            "container_shell",
            "sensitive_file_access"
        ],
        "affected_components": [
            "netdevops-app",
            "pg_isready"
        ],
        "timeline": [
            {
                "timestamp": "21:05:18.611052300",
                "event": "sensitive_file_access",
                "status": "observed"
            },
            {
                "timestamp": "21:19:43.386001109",
                "event": "container_shell",
                "status": "observed"
            }
        ],
        "evidence": [
            {
                "type": "signal",
                "name": "container_shell",
                "source": "Phase3.7 Correlation Engine",
                "confidence": 0.9
            },
            {
                "type": "signal",
                "name": "sensitive_file_access",
                "source": "Phase3.7 Correlation Engine",
                "confidence": 0.9
            },
            {
                "type": "timeline_event",
                "timestamp": "21:05:18.611052300",
                "event": "sensitive_file_access",
                "source": "Incident Timeline"
            },
            {
                "type": "timeline_event",
                "timestamp": "21:19:43.386001109",
                "event": "container_shell",
                "source": "Incident Timeline"
            }
        ],
        "recommendations": [
            "Isolate the affected pod from the network.",
            "Review Falco alerts related to the incident.",
            "Inspect container logs for suspicious activity.",
            "Verify recent deployment and image changes.",
            "Rotate any potentially exposed credentials."
        ]
    },
    {
        "package_version": "1.0",
        "generated_by": "Phase3.8 AegisAI Package Builder",
        "incident": {
            "id": "INC-002",
            "type": "pod_restart_cycle",
            "severity": "MEDIUM",
            "detected_at": "2026-06-19T22:42:39Z"
        },
        "root_cause": {
            "id": "pod_restart_cycle",
            "name": "Pod Restart Cycle",
            "hint": "Likely workload restart. Investigate pod events and deployment history.",
            "confidence": 0.75
        },
        "signals": [
            "pod_terminated",
            "pod_started"
        ],
        "affected_components": [
            "netdevops-app-78d8bd544f-th7dq",
            "netdevops-app-78d8bd544f-wc85l"
        ],
        "timeline": [
            {
                "timestamp": "2026-06-19T22:42:39Z",
                "event": "pod_terminated",
                "status": "observed"
            },
            {
                "timestamp": "2026-06-19T22:42:42Z",
                "event": "pod_started",
                "status": "observed"
            }
        ],
        "evidence": [
            {
                "type": "signal",
                "name": "pod_terminated",
                "source": "Phase3.7 Correlation Engine",
                "confidence": 0.9
            },
            {
                "type": "signal",
                "name": "pod_started",
                "source": "Phase3.7 Correlation Engine",
                "confidence": 0.9
            },
            {
                "type": "timeline_event",
                "timestamp": "2026-06-19T22:42:39Z",
                "event": "pod_terminated",
                "source": "Incident Timeline"
            },
            {
                "type": "timeline_event",
                "timestamp": "2026-06-19T22:42:42Z",
                "event": "pod_started",
                "source": "Incident Timeline"
            }
        ],
        "recommendations": [
            "Inspect pod logs for crash reasons.",
            "Check Kubernetes events for restart triggers.",
            "Review deployment rollout history.",
            "Verify container readiness and liveness probes.",
            "Investigate application startup failures."
        ]
    },
    {
        "package_version": "1.0",
        "generated_by": "Phase3.8 AegisAI Package Builder",
        "incident": {
            "id": "INC-003",
            "type": "resource_pressure",
            "severity": "HIGH",
            "detected_at": "2026-06-19T22:42:39Z"
        },
        "root_cause": {
            "id": "resource_pressure",
            "name": "Resource Pressure",
            "hint": "Likely resource exhaustion caused pod instability.",
            "confidence": 0.85
        },
        "signals": [
            "cpu_metric_detected",
            "pod_terminated"
        ],
        "affected_components": [
            "cluster",
            "netdevops-app-78d8bd544f-th7dq"
        ],
        "timeline": [
            {
                "timestamp": "2026-06-19T22:42:39Z",
                "event": "pod_terminated",
                "status": "observed"
            },
            {
                "timestamp": "2026-06-19T22:42:39Z",
                "event": "cpu_metric_detected",
                "status": "observed"
            }
        ],
        "evidence": [
            {
                "type": "signal",
                "name": "cpu_metric_detected",
                "source": "Phase3.7 Correlation Engine",
                "confidence": 0.9
            },
            {
                "type": "signal",
                "name": "pod_terminated",
                "source": "Phase3.7 Correlation Engine",
                "confidence": 0.9
            },
            {
                "type": "timeline_event",
                "timestamp": "2026-06-19T22:42:39Z",
                "event": "pod_terminated",
                "source": "Incident Timeline"
            },
            {
                "type": "timeline_event",
                "timestamp": "2026-06-19T22:42:39Z",
                "event": "cpu_metric_detected",
                "source": "Incident Timeline"
            }
        ],
        "recommendations": [
            "Review CPU and memory utilization metrics.",
            "Check node resource availability.",
            "Inspect resource requests and limits.",
            "Identify resource-intensive workloads.",
            "Consider scaling the affected workload."
        ]
    }
]